{
  "schema_version": 1,
  "document": "cnsd-2026-08-27-e9f7f97545",
  "annotation_status": "CORRECTED",
  "scope_note": "Segunda revisión interna. Incluye CVE, actor y malware nombrados, países objetivo, tecnologías operativas usadas o atacadas e IOCs concretos. Excluye productos y versiones citados solo como contexto de vulnerabilidades, URLs bibliográficas, rutas y artefactos de host, nombres de archivo y la URL plantilla con <Dirección MAC>. Las conductas sin mapeo ATT&CK explícito se adjudicarán aparte y no se tratarán automáticamente como falsos positivos.",
  "entities": [
    {
      "id": "e1",
      "type": "vulnerability",
      "value": "CVE-2026-57910",
      "source_value": "CVE -2026 -57910",
      "quote": "Las vulnerabilidades, identificadas como CVE -2026 -57910 y CVE -2026 -57909, fueron divulgad as por WatchGuard el 25 de agosto de 2026 y afectan a versiones de WatchGuard Agent anteriores a la 1.25.13.0000.",
      "page": 4
    },
    {
      "id": "e2",
      "type": "vulnerability",
      "value": "CVE-2026-57909",
      "source_value": "CVE -2026 -57909",
      "quote": "Las vulnerabilidades, identificadas como CVE -2026 -57910 y CVE -2026 -57909, fueron divulgad as por WatchGuard el 25 de agosto de 2026 y afectan a versiones de WatchGuard Agent anteriores a la 1.25.13.0000.",
      "page": 4
    },
    {
      "id": "e4",
      "type": "vulnerability",
      "value": "CVE-2026-60004",
      "source_value": "CVE-2026 -60004",
      "quote": "La vulnerabilidad de severidad \" crítica \" identificada por MITRE como \" CVE-2026 -60004 \", clasificada como CWE -94: Inyección de Código que afecta a Gitea en sus versiones desde la 1.17 hasta la 1.27.0 (inclusive), podría permitir la ejecución arbitraria de comandos e n el servidor subyacente mediante el envío de parches maliciosos al endpoint de la API diffpatch para instalar hooks de Git ejecutables.",
      "page": 6
    },
    {
      "id": "e6",
      "type": "vulnerability",
      "value": "CVE-2026-18963",
      "source_value": "CVE-2026 -18963",
      "quote": "La vulnerabilidad de severidad \" crítica \" identificada por MITRE como \" CVE-2026 -18963 \", clasificada como \"CWE - 640: Mecanismo débil de recuperación de contraseña para contraseñas olvidadas\" que afecta a Red Hat Build of Keycloak , Red Hat JBoss Enterprise Applica tion Platform Expansion Pack y distribuciones de Keycloak, podría permitir a un atacante no autenticado evadir los controles de seguridad del flujo reset -credentials.",
      "page": 8
    },
    {
      "id": "e9",
      "type": "threat-actor",
      "value": "Kimsuky",
      "quote": "El equipo de investigación de ENKI WhiteHat detectó durante la primera mitad de 2026 una serie de campañas de spear -phishing operadas por el grupo APT Kimsuky contra objetivos estratégicos en Corea del Sur y Japón.",
      "page": 9
    },
    {
      "id": "e10",
      "type": "country",
      "value": "Corea del Sur",
      "quote": "El equipo de investigación de ENKI WhiteHat detectó durante la primera mitad de 2026 una serie de campañas de spear -phishing operadas por el grupo APT Kimsuky contra objetivos estratégicos en Corea del Sur y Japón.",
      "page": 9
    },
    {
      "id": "e11",
      "type": "country",
      "value": "Japón",
      "quote": "El equipo de investigación de ENKI WhiteHat detectó durante la primera mitad de 2026 una serie de campañas de spear -phishing operadas por el grupo APT Kimsuky contra objetivos estratégicos en Corea del Sur y Japón.",
      "page": 9
    },
    {
      "id": "e12",
      "type": "technology",
      "value": "Microsoft Windows",
      "source_value": "Windows",
      "quote": "Actores maliciosos están utilizando banners de servidores FTP para ocultar comandos y distribuir dos troyanos de acceso remoto (RAT) no documentados anteriormente, denominados “E4del ” y “PINHOLE ”, dirigidos a sistemas con sistema operativo Windows.",
      "page": 12
    },
    {
      "id": "e13",
      "type": "malware",
      "value": "E4del",
      "source_value": "E4del ”",
      "quote": "Actores maliciosos están utilizando banners de servidores FTP para ocultar comandos y distribuir dos troyanos de acceso remoto (RAT) no documentados anteriormente, denominados “E4del ” y “PINHOLE ”, dirigidos a sistemas con sistema operativo Windows.",
      "page": 12
    },
    {
      "id": "e14",
      "type": "malware",
      "value": "PINHOLE",
      "source_value": "PINHOLE ”",
      "quote": "Actores maliciosos están utilizando banners de servidores FTP para ocultar comandos y distribuir dos troyanos de acceso remoto (RAT) no documentados anteriormente, denominados “E4del ” y “PINHOLE ”, dirigidos a sistemas con sistema operativo Windows.",
      "page": 12
    },
    {
      "id": "e15",
      "type": "technology",
      "value": "Node.js",
      "quote": "El malware E4del es un troyano de acceso remoto basado en Node.js empaquetado dentro de una aplicación de Electron firmada digitalmente que suplanta la identidad de Discord; entre sus capacidades destacan la ejecución de comandos a través de consolas permanentes o temporales, captura de pantalla, transmisión del escritorio vía WebSockets y la descarga y ejecución de c argas útiles adicionales, incluyendo un módulo Node.js (crypto32.node) orientado a la elevación de privilegios.",
      "page": 12
    },
    {
      "id": "e16",
      "type": "technology",
      "value": "Electron",
      "quote": "El malware E4del es un troyano de acceso remoto basado en Node.js empaquetado dentro de una aplicación de Electron firmada digitalmente que suplanta la identidad de Discord; entre sus capacidades destacan la ejecución de comandos a través de consolas permanentes o temporales, captura de pantalla, transmisión del escritorio vía WebSockets y la descarga y ejecución de c argas útiles adicionales, incluyendo un módulo Node.js (crypto32.node) orientado a la elevación de privilegios.",
      "page": 12
    },
    {
      "id": "e17",
      "type": "technology",
      "value": "Pinterest",
      "quote": "Por su parte, PINHOLE recupera su configuración de comando y control (C2) mediante publicaciones en Pinterest y preguntas en encuestas de Survey Monkey para evadir bloqueos; además, minimiza su huella en el sistema mediante la técnica de fluctuación de shellcode (manteniendo solo un bloque de 4 KB en memoria) e inyecta su carga final en el proceso suspendido ApplicationFrameHost.exe utilizando Earl y Bird APC injection, permitiéndole listar archivos, gestionar procesos, capturar pantallas y robar credenciales del navegador.",
      "page": 12
    },
    {
      "id": "e18",
      "type": "technology",
      "value": "Survey Monkey",
      "quote": "Por su parte, PINHOLE recupera su configuración de comando y control (C2) mediante publicaciones en Pinterest y preguntas en encuestas de Survey Monkey para evadir bloqueos; además, minimiza su huella en el sistema mediante la técnica de fluctuación de shellcode (manteniendo solo un bloque de 4 KB en memoria) e inyecta su carga final en el proceso suspendido ApplicationFrameHost.exe utilizando Earl y Bird APC injection, permitiéndole listar archivos, gestionar procesos, capturar pantallas y robar credenciales del navegador.",
      "page": 12
    },
    {
      "id": "e19",
      "type": "vulnerability",
      "value": "CVE-2026-77148",
      "source_value": "CVE-2026 -77148",
      "quote": "La vulnerabilidad se severidad \" crítica \" identificada por MITRE como CVE-2026 -77148 clasificada como \"CWE -119 / CWE -121 (Desbordamiento de Búfer Basado en Stack)\" que afecta a router/repetidor Comfas t CF-N1-S en su versión 2.6.0.1, podría permitir a un atacante remoto autenticado con bajos privilegios inyectar datos manipulados en la función sub_44B50C del componente Web Management (a través del endpoint /cgi -bin/mbox - config?method=SET&section=ptest_c hannel).",
      "page": 13
    },
    {
      "id": "e21",
      "type": "indicator",
      "value": "103.77.242.187",
      "source_value": "103.77.242 [.]187",
      "ioc_type": "ip",
      "quote": "− 103.77.242 [.]187.",
      "page": 10
    },
    {
      "id": "e22",
      "type": "indicator",
      "value": "103.249.117.183",
      "source_value": "103.249.117 [.]183",
      "ioc_type": "ip",
      "quote": "− 103.249.117 [.]183.",
      "page": 10
    },
    {
      "id": "e23",
      "type": "indicator",
      "value": "160.187.147.119",
      "source_value": "160.187.147 [.]119",
      "ioc_type": "ip",
      "quote": "− 160.187.147 [.]119.",
      "page": 10
    },
    {
      "id": "e24",
      "type": "indicator",
      "value": "84.247.145.65",
      "source_value": "84.247.145 [.]65",
      "ioc_type": "ip",
      "quote": "− 84.247.145 [.]65.",
      "page": 10
    },
    {
      "id": "e25",
      "type": "indicator",
      "value": "210.183.177.217",
      "source_value": "210.183.177 [.]217",
      "ioc_type": "ip",
      "quote": "− 210.183.177 [.]217.",
      "page": 10
    },
    {
      "id": "e26",
      "type": "indicator",
      "value": "sweet-iki-4263.holy.jp",
      "source_value": "sweet -iki-4263.holy.jp",
      "ioc_type": "domain",
      "quote": "− sweet -iki-4263.holy.jp .",
      "page": 10
    },
    {
      "id": "e27",
      "type": "indicator",
      "value": "https://1drv.ms/u/c/2c732f3239360d98/IQDihidlH5aGTK-prrMLTrBIAcbEYFb4_w7HUbeFeiZU6Go?e=wpzaBO",
      "source_value": "hxxps://1drv[.]ms/u/c/2c732f3239360d98/IQDihidlH5aGTK - prrMLTrBIAcbEYFb4_w7HUbeFeiZU6Go?e=wpzaBO",
      "ioc_type": "url",
      "quote": "− hxxps://1drv[.]ms/u/c/2c732f3239360d98/IQDihidlH5aGTK - prrMLTrBIAcbEYFb4_w7HUbeFeiZU6Go?e=wpzaBO .",
      "page": 10
    },
    {
      "id": "e28",
      "type": "indicator",
      "value": "http://103.77.242.187/JINF.pdf",
      "source_value": "hxxp://103.77.242[.]187/JINF.pdf",
      "ioc_type": "url",
      "quote": "− hxxp://103.77.242[.]187/JINF.pdf .",
      "page": 10
    },
    {
      "id": "e29",